{
  "schema_version": 2,
  "id": "readcode-003",
  "version": 1,
  "bugs": [
    {
      "id": "B1",
      "title": "Backoff restarts from the first delay on every retry",
      "pattern": "backoff-state-reset-per-retry",
      "locations": [
        {
          "file": "RetryPolicy.ts",
          "function": "execute",
          "start_line": 137,
          "end_line": 139
        }
      ],
      "description": "execute() asks the factory for a fresh backoff on every retry (factory.next(context)) instead of advancing the one it already has (backoff.next(context)). The backoff variable is overwritten each time and never chained, so the sequence never moves past its first step.",
      "runtime_failure": "Every retry waits only the first delay of the backoff: with ExponentialBackoff and the default decorrelated jitter that is a random value of roughly 0-180 ms, every time. The delay never grows and never reaches maxDelay, so during an outage each caller retries several times a second instead of backing off; with many callers this multiplies load on the failing service (a retry storm). retry() defaults maxAttempts to Infinity, so callers keep retrying fast until the service recovers or the call is cancelled.",
      "conditions": "Only with a backoff that changes between attempts (ExponentialBackoff, IterableBackoff); with ConstantBackoff the result is identical. Only noticeable when a call fails several times in a row, i.e. during a sustained outage; tests with one or two failures and short delays pass.",
      "fix": "Advance the existing backoff: backoff = backoff ? backoff.next(context) : factory.next(context)."
    }
  ],
  "worsenings": [
    {
      "id": "W1",
      "title": "Waiting for a retry by polling the clock every millisecond",
      "kind": "resource-use",
      "description": "delay() uses setInterval with a 1 ms period and checks elapsed time on every tick, instead of one setTimeout for the whole duration. The result is the same, but each pending retry wakes the event loop about a thousand times per second.",
      "when_it_matters": "With many retries waiting at once, typically during an outage when one shared policy has thousands of calls in its backoff.",
      "better": "One setTimeout(..., duration) whose callback disposes the abort listener and resolves; clearTimeout in the abort handler.",
      "locations": [
        {
          "file": "RetryPolicy.ts",
          "start_line": 12,
          "end_line": 36
        }
      ]
    }
  ],
  "rubric": [
    {
      "id": "R22",
      "question_id": "Q1",
      "kind": "required",
      "point": "Call 1 (attempt 0) fails; onRetry fires with attempt 1 and delay 100; it waits 100 ms. Call 2 (attempt 1) fails; onRetry fires with attempt 2 and delay 100; it waits 100 ms."
    },
    {
      "id": "R23",
      "question_id": "Q1",
      "kind": "required",
      "point": "Call 3 (attempt 2) returns 'ok' and execute() resolves to 'ok' after about 200 ms; onGiveUp never fires."
    },
    {
      "id": "R24",
      "question_id": "Q1",
      "kind": "bonus",
      "point": "onRetry is emitted before the wait starts, and onSuccess fires once for the whole execute(), not per call."
    },
    {
      "id": "R25",
      "question_id": "Q2",
      "kind": "required",
      "point": "ExecuteWrapper.invoke catches the TypeError, the error filter (instanceof NetworkError) says no, and it rethrows: execute() rejects with the TypeError on the first call, with no retry."
    },
    {
      "id": "R26",
      "question_id": "Q2",
      "kind": "required",
      "point": "Neither onRetry nor onGiveUp fires; onFailure fires with handled: false (when something listens to it)."
    },
    {
      "id": "R27",
      "question_id": "Q2",
      "kind": "bonus",
      "point": "A NetworkError instead would be returned as { error }, retried up to 3 more times, and then thrown after onGiveUp."
    },
    {
      "id": "R28",
      "question_id": "Q3",
      "kind": "required",
      "point": "[100, 1], [200, 2], [400, 3], [800, 4]: the delay is initialDelay * 2^attempts, capped at maxDelay (a fifth call would give 1000), and the state is just the next attempt number."
    },
    {
      "id": "R29",
      "question_id": "Q3",
      "kind": "required",
      "point": "decorrelatedJitterGenerator keeps [attempt + 1, the formula value], so each delay depends on the previous one, and adds randomness through t = attempt + Math.random()."
    },
    {
      "id": "R30",
      "question_id": "Q3",
      "kind": "bonus",
      "point": "The randomness spreads callers out so they do not retry in lockstep."
    },
    {
      "id": "R9",
      "question_id": "Q4",
      "kind": "required",
      "point": "execute() calls factory.next(context) on every retry instead of backoff.next(context), so the backoff starts over each time instead of advancing.",
      "bug_id": "B1"
    },
    {
      "id": "R10",
      "question_id": "Q4",
      "kind": "required",
      "point": "Every retry therefore waits only the first, short delay; the wait never grows, so during an outage callers keep retrying quickly and pile load onto the failing service (retry storm).",
      "bug_id": "B1"
    },
    {
      "id": "R11",
      "question_id": "Q4",
      "kind": "required",
      "point": "It shows only with a growing backoff (e.g. ExponentialBackoff) and repeated failures; with ConstantBackoff or quick recovery it looks fine.",
      "bug_id": "B1"
    },
    {
      "id": "R12",
      "question_id": "Q4",
      "kind": "bonus",
      "point": "Fix: backoff = backoff ? backoff.next(context) : factory.next(context).",
      "bug_id": "B1"
    },
    {
      "id": "R13",
      "question_id": "Q4",
      "kind": "bonus",
      "point": "retry() defaults maxAttempts to Infinity, so the fast retries continue until the service recovers or the call is cancelled.",
      "bug_id": "B1"
    },
    {
      "id": "R14",
      "question_id": "Q5",
      "kind": "required",
      "point": "Each execute() call needs its own sequence; immutable backoffs let one shared policy run many concurrent calls without them interfering, and keep strategies (constant, exponential, custom) pluggable behind one interface."
    },
    {
      "id": "R15",
      "question_id": "Q5",
      "kind": "bonus",
      "point": "ConstantBackoff.next() can simply return this; the generators are pure functions of (state, options), which makes them easy to test."
    },
    {
      "id": "R16",
      "question_id": "Q6",
      "kind": "required",
      "point": "Before: do not start waiting if the call is already cancelled. After: delay() resolves early when the signal aborts, so check again and give up instead of making another call."
    },
    {
      "id": "R17",
      "question_id": "Q6",
      "kind": "bonus",
      "point": "delay() clears its timer and abort listener on either path, so cancelled calls do not leak timers."
    },
    {
      "id": "R31",
      "question_id": "Q7",
      "kind": "required",
      "point": "delay() polls with setInterval every millisecond and compares Date.now() with the start, so a 30-second wait wakes the event loop about 30 000 times instead of once.",
      "worsening_id": "W1"
    },
    {
      "id": "R32",
      "question_id": "Q7",
      "kind": "required",
      "point": "Use a single setTimeout(resolve, duration) and clear it in the abort handler; the abort listener already covers cancellation.",
      "worsening_id": "W1"
    },
    {
      "id": "R33",
      "question_id": "Q7",
      "kind": "bonus",
      "point": "It matters when many retries wait at once (one shared policy, thousands of calls during an outage): thousands of 1 ms timers keep the CPU busy exactly when the system is under stress.",
      "worsening_id": "W1"
    },
    {
      "id": "R20",
      "question_id": "Q8",
      "kind": "required",
      "point": "A finite maxAttempts and an overall deadline per call, with exponential backoff plus jitter and a maxDelay cap."
    },
    {
      "id": "R21",
      "question_id": "Q8",
      "kind": "bonus",
      "point": "A shared retry budget (retries as a fraction of calls), a circuit breaker in front of the retries, or honouring Retry-After from the service."
    }
  ],
  "reveal_after_bug": [
    "Q5"
  ],
  "grader_notes": [
    "A line comment around RetryPolicy.ts line 138 that explains the reset earns R9 to R11 even if Q4 is blank.",
    "Q3 asks about the generator itself; do not require the candidate to notice the bug there."
  ]
}
