{
  "schema_version": 2,
  "id": "readcode-005",
  "version": 1,
  "bugs": [
    {
      "id": "B1",
      "title": "The loop never waits when the pool is full",
      "pattern": "backpressure-wait-not-awaited",
      "locations": [
        {
          "file": "pool.ts",
          "function": "pooledMap",
          "start_line": 85,
          "end_line": 87
        }
      ],
      "description": "When executing.length reaches poolLimit the loop calls Promise.race(executing) but does not await it, so it never pauses. The check exists, but nothing waits for a slot to free up before the next item is pulled from the input and started.",
      "runtime_failure": "Every item starts as soon as it is read: with 10,000 items, about 10,000 calls to iteratorFn run at once, whatever poolLimit says. The input is drained eagerly (an endless or very large async iterable is read as fast as it produces), so the service being called is flooded and memory grows with the number of in-flight calls. If a call fails, the race promise rejects with nobody awaiting it (an unhandled rejection), and the catch block that stops new work is never reached.",
      "conditions": "Only noticeable when the input has more items than poolLimit and the calls take time (network, I/O). The results themselves are still all there and in order, so tests that only check the output pass.",
      "fix": "Await the race: await Promise.race(executing);"
    }
  ],
  "worsenings": [
    {
      "id": "W1",
      "title": "Removing a finished call rebuilds the whole array",
      "kind": "performance",
      "description": "Each finished call removes itself by filtering the executing array into a new array and splicing all of it back, instead of removing its own entry.",
      "when_it_matters": "With a large poolLimit, where every completion copies hundreds or thousands of entries.",
      "better": "executing.splice(executing.indexOf(e), 1), or a Set of running promises with delete(e).",
      "locations": [
        {
          "file": "pool.ts",
          "start_line": 81,
          "end_line": 83
        }
      ]
    }
  ],
  "rubric": [
    {
      "id": "R18",
      "question_id": "Q1",
      "kind": "required",
      "point": "All three start at 0 ms (three items fit in a pool of 5); 1 finishes at 100 ms, 2 at 200 ms and 4 at 400 ms."
    },
    {
      "id": "R19",
      "question_id": "Q1",
      "kind": "required",
      "point": "The results are yielded in input order, 4, 1, 2, and the first one only appears at 400 ms because 4 is first in line; 1 and 2 follow straight after."
    },
    {
      "id": "R20",
      "question_id": "Q2",
      "kind": "required",
      "point": "At 0 ms the entries for 4, 1 and 2; at 100 ms the entry for 1 has removed itself, leaving 4 and 2; at 200 ms only 4; at 400 ms it is empty."
    },
    {
      "id": "R21",
      "question_id": "Q2",
      "kind": "bonus",
      "point": "Each entry is the call's promise followed by its own removal, so an entry leaves the array exactly when its call finishes."
    },
    {
      "id": "R5",
      "question_id": "Q3",
      "kind": "required",
      "point": "Promise.race(executing) is not awaited, so the loop never pauses when the pool is full.",
      "bug_id": "B1"
    },
    {
      "id": "R6",
      "question_id": "Q3",
      "kind": "required",
      "point": "So every item starts immediately: with a large input, thousands of calls run at once and poolLimit is ignored; there is no backpressure on the input.",
      "bug_id": "B1"
    },
    {
      "id": "R7",
      "question_id": "Q3",
      "kind": "required",
      "point": "It only shows with more items than poolLimit and slow calls; the results are still complete and in order, so output-only tests pass.",
      "bug_id": "B1"
    },
    {
      "id": "R8",
      "question_id": "Q3",
      "kind": "bonus",
      "point": "Fix: await Promise.race(executing).",
      "bug_id": "B1"
    },
    {
      "id": "R9",
      "question_id": "Q3",
      "kind": "bonus",
      "point": "Consequences: the called service is overloaded or rate-limits, memory grows, an endless input is read without limit, and a failed call becomes an unhandled rejection instead of stopping new work.",
      "bug_id": "B1"
    },
    {
      "id": "R10",
      "question_id": "Q4",
      "kind": "required",
      "point": "race resumes as soon as any one call finishes, freeing exactly one slot; all would wait for every running call, leaving slots idle behind the slowest one."
    },
    {
      "id": "R11",
      "question_id": "Q4",
      "kind": "bonus",
      "point": "race also rejects as soon as one call fails, which stops new work promptly."
    },
    {
      "id": "R12",
      "question_id": "Q5",
      "kind": "required",
      "point": "So calls run in parallel while the output keeps the input order: the stream holds the promises in order and the reading side awaits them one by one."
    },
    {
      "id": "R13",
      "question_id": "Q5",
      "kind": "bonus",
      "point": "writer.write() is not awaited either, so if the caller reads slowly, finished results pile up in the stream: the pool limits running calls, not unread results."
    },
    {
      "id": "R22",
      "question_id": "Q6",
      "kind": "required",
      "point": "When a call finishes it filters the whole executing array into a new array and copies it back, instead of removing the one finished entry.",
      "worsening_id": "W1"
    },
    {
      "id": "R23",
      "question_id": "Q6",
      "kind": "required",
      "point": "Remove just that entry: executing.splice(executing.indexOf(e), 1), or keep the running calls in a Set and delete(e).",
      "worsening_id": "W1"
    },
    {
      "id": "R24",
      "question_id": "Q6",
      "kind": "bonus",
      "point": "It matters with a large poolLimit (hundreds or thousands): every completion allocates and copies the whole array, and spreading a very large array into splice can even exceed the argument limit.",
      "worsening_id": "W1"
    },
    {
      "id": "R16",
      "question_id": "Q7",
      "kind": "required",
      "point": "Today the loop keeps reading the input and starting calls even after the caller stops reading. Add a way to stop: an AbortSignal option, or stop when the returned iterator is closed (return() / break), and then stop pulling input and starting calls."
    },
    {
      "id": "R17",
      "question_id": "Q7",
      "kind": "bonus",
      "point": "Cancel the stream so the writer's writes fail, call the input iterator's return(), and decide whether running calls are cancelled or allowed to finish."
    }
  ],
  "reveal_after_bug": [
    "Q4"
  ],
  "grader_notes": [
    "A line comment on pool.ts line 86 that says the race is not awaited and explains the effect earns R5 to R7 even if Q3 is blank.",
    "This is the easiest level: accept plain-language answers (\"it starts everything at once\") for R6."
  ]
}
